<?xml version="1.0" encoding="UTF-8"?>
<tns:rate xmlns:tns="http://www.example.org/MySchema" xmlns:xsi="http://www.w3.org/2001/XMLSchema-instance" xsi:schemaLocation="http://www.example.org/MySchema MySchema.xsd ">
  <tns:name>Tariff</tns:name>
  <tns:providerName>Kyivstar</tns:providerName>
  <tns:subscriptionFee>333</tns:subscriptionFee>
  <tns:gigabytePrices id="0">
    <tns:name>tns:name</tns:name>
    <tns:price>0.0</tns:price>
  </tns:gigabytePrices>
  <tns:videotecaFilmPrice>0.0</tns:videotecaFilmPrice>
  <tns:parameters id="1">
    <tns:name>additionalSpeed</tns:name>
    <tns:price>11</tns:price>
  </tns:parameters>
  <tns:parameters>
  	<tns:name>tns:name</tns:name>
  	<tns:price>0.0</tns:price>
  </tns:parameters>
</tns:rate>
